<?xml version="1.0" encoding="UTF-8"?>
<source xmlns="http://snee.cs.man.ac.uk/namespace/physical-schema"
	xmlns:xsi="http://www.w3.org/2001/XMLSchema-instance"
	xsi:schemaLocation="http://snee.cs.man.ac.uk/namespace/physical-schema ../schema/physical-schema.xsd ">

	<sensor_network name="wsn1">
		<topology>wsn_query76.xml</topology>
		<site-resources>siteRes76.xml</site-resources>
		<gateways>0</gateways>
		<extents>
			<extent name="A">
				<sites>2,49,11,25,47</sites>
			</extent>
			<extent name="B">
				<sites>47,28,6,46,32</sites>
			</extent>
		</extents> 
	</sensor_network> 
</source>
