<?xml version="1.0" encoding="UTF-8"?>
<source xmlns="http://snee.cs.man.ac.uk/namespace/physical-schema"
	xmlns:xsi="http://www.w3.org/2001/XMLSchema-instance"
	xsi:schemaLocation="http://snee.cs.man.ac.uk/namespace/physical-schema ../schema/physical-schema.xsd ">

	<sensor_network name="wsn1">
		<topology>testsNatural/wsn_query52.xml</topology>
		<site-resources>testsNatural/siteRes52.xml</site-resources>
		<gateways>0</gateways>
		<extents>
			<extent name="A">
				<sites>36,42,33,17,39,10,19,2,35</sites>
			</extent>
		</extents> 
	</sensor_network> 
</source>
