<?xml version="1.0" encoding="UTF-8"?>
<source xmlns="http://snee.cs.man.ac.uk/namespace/physical-schema"
	xmlns:xsi="http://www.w3.org/2001/XMLSchema-instance"
	xsi:schemaLocation="http://snee.cs.man.ac.uk/namespace/physical-schema ../schema/physical-schema.xsd ">

	<sensor_network name="wsn1">
		<topology>RecursiveTest/3main/wsn1-topology.xml</topology>
		<site-resources>etc/common/tmotesky-site-resources.xml</site-resources>
		<gateways>1</gateways>
		<extents>
			<extent name="Castilla">
				<sites>4,6,8,9,11,12</sites>
			</extent>
		</extents>
	</sensor_network>

</source>
