<?xml version="1.0" encoding="UTF-8"?>
<source xmlns="http://snee.cs.man.ac.uk/namespace/physical-schema"
	xmlns:xsi="http://www.w3.org/2001/XMLSchema-instance"
	xsi:schemaLocation="http://snee.cs.man.ac.uk/namespace/physical-schema ../schema/physical-schema.xsd ">

	<sensor_network name="wsn1">
		<topology>testsSize100/wsn_query82.xml</topology>
		<site-resources>testsSize100/siteRes82.xml</site-resources>
		<gateways>0</gateways>
		<extents>
			<extent name="A">
				<sites>9,21,38</sites>
			</extent>
			<extent name="B">
				<sites>38,16,28</sites>
			</extent>
			<extent name="C">
				<sites>28,5,1</sites>
			</extent>
			<extent name="D">
				<sites>1,29,36</sites>
			</extent>
		</extents> 
	</sensor_network> 
</source>
