<?xml version="1.0" encoding="UTF-8"?>
<source xmlns="http://snee.cs.man.ac.uk/namespace/physical-schema"
	xmlns:xsi="http://www.w3.org/2001/XMLSchema-instance"
	xsi:schemaLocation="http://snee.cs.man.ac.uk/namespace/physical-schema ../schema/physical-schema.xsd ">

	<sensor_network name="wsn1">
		<topology>tests/wsn_query98.xml</topology>
		<site-resources>etc/common/tmotesky-site-resources.xml</site-resources>
		<gateways>0</gateways>
		<extents>
			<extent name="A">
				<sites>14,9</sites>
			</extent>
			<extent name="B">
				<sites>9,6</sites>
			</extent>
			<extent name="C">
				<sites>6,5</sites>
			</extent>
			<extent name="D">
				<sites>5,4</sites>
			</extent>
			<extent name="E">
				<sites>4</sites>
			</extent>
		</extents> 
	</sensor_network> 
</source>
