<?xml version="1.0" encoding="UTF-8"?>
<source xmlns="http://snee.cs.man.ac.uk/namespace/physical-schema"
	xmlns:xsi="http://www.w3.org/2001/XMLSchema-instance"
	xsi:schemaLocation="http://snee.cs.man.ac.uk/namespace/physical-schema ../schema/physical-schema.xsd ">

	<sensor_network name="wsn1">
		<topology>condorchecks/top4.5.xml</topology>
		<site-resources>condorchecks/siteRes4.5.xml</site-resources>
		<gateways>0</gateways>
		<extents>
			<extent name="A">
				<sites>9,5,7,3,6,0,2,12,10</sites>
			</extent>
		</extents> 
	</sensor_network> 
</source>
