<?xml version="1.0" encoding="UTF-8"?>
<source xmlns="http://snee.cs.man.ac.uk/namespace/physical-schema"
	xmlns:xsi="http://www.w3.org/2001/XMLSchema-instance"
	xsi:schemaLocation="http://snee.cs.man.ac.uk/namespace/physical-schema ../schema/physical-schema.xsd ">

	<sensor_network name="wsn1">
		<topology>starTopologies/wsn_query1.xml</topology>
		<site-resources>starTopologies/siteRes1.xml</site-resources>
		<gateways>0</gateways>
		<extents>
			<extent name="A">
				<sites>1,2</sites>
			</extent>
			<extent name="B">
				<sites>3,4</sites>
			</extent>
		</extents> 
	</sensor_network> 
</source>
